ID,Referencia del texto,Referencia bibliográfica APA,Tema,Tesis,Propósito,Ideas centrales,Conceptos claves,Conclusiones
1,"Resnick, M., & Silverman, B. (2005).","Resnick, M., & Silverman, B. (2005). Some reflections on designing construction kits for kids. Proceedings of the 2005 Conference on Interaction Design and Children, 117–122. https://doi.org/10.1145/1109540.1109556","Diseño de herramientas de programación para principiantes.","Las herramientas de construcción visual para principiantes deben seguir el principio de bajo suelo alto techo para ser accesibles y poderosas simultáneamente.","Presentar principios de diseño para kits de construcción digital orientados a novatos.","Principio low-floor/high-ceiling. Diseño centrado en el aprendiz. Herramientas de creación digital.","low-floor high-ceiling, diseño instruccional, programación visual.","Las herramientas bien diseñadas permiten a principiantes crear proyectos complejos de manera progresiva."
2,"Fraser, N. (2015).","Fraser, N. (2015). Ten things we've learned from Blockly. Proceedings of the 2015 IEEE Blocks and Beyond Workshop, 49–50. https://doi.org/10.1109/BLOCKS.2015.7369000","Diseño y evolución de Blockly como herramienta de programación visual.","Blockly demuestra que es posible construir entornos de programación visual robustos y extensibles para múltiples dominios de aplicación.","Presentar las lecciones aprendidas en el desarrollo de la librería Blockly de Google.","Extensibilidad de herramientas de bloques. Integración con otros lenguajes. Generación de código desde bloques visuales.","Blockly, programación visual, generación de código.","Las herramientas como Blockly pueden adaptarse a diferentes dominios incluyendo bases de datos."
3,"Weintrop, D., & Wilensky, U. (2015).","Weintrop, D., & Wilensky, U. (2015). To block or not to block, that is the question: Students' perceptions of blocks-based programming. Proceedings of the 14th International Conference on Interaction Design and Children, 199–208. https://doi.org/10.1145/2771839.2771860","Percepciones estudiantiles sobre programación en bloques.","Los estudiantes perciben la programación en bloques como más accesible que la textual especialmente en etapas iniciales de aprendizaje.","Analizar cómo los estudiantes perciben y valoran la programación en bloques frente a la textual.","Percepción estudiantil. Transición bloques-texto. Accesibilidad de herramientas.","programación en bloques, percepción estudiantil, accesibilidad.","Los bloques son preferidos por principiantes y facilitan la transición hacia programación textual."
4,"Weintrop, D. (2019).","Weintrop, D. (2019). Block-based programming in computer science education. Communications of the ACM, 62(10), 22–25.","Programación en bloques en la educación en ciencias de la computación.","La programación en bloques ha evolucionado para convertirse en una herramienta pedagógica central en la educación en ciencias de la computación a nivel introductorio.","Analizar el rol actual de la programación en bloques en la enseñanza de informática.","Evolución de herramientas de bloques. Uso en educación K-12 y universitaria. Impacto en el aprendizaje de programación.","block-based programming, CS education, herramientas educativas.","La programación en bloques es una estrategia consolidada para introducir conceptos computacionales a principiantes."
5,"Scratch Foundation. (2023).","Scratch Foundation. (2023). Scratch statistics. https://scratch.mit.edu/statistics","Adopción global de Scratch como plataforma de programación visual.","La masificación de Scratch a nivel mundial evidencia la efectividad de las plataformas de programación visual para el aprendizaje inicial de la computación.","Documentar el alcance y uso global de Scratch como referente de programación en bloques.","Adopción global. Diversidad de usuarios. Comunidad de aprendizaje.","Scratch, programación visual, comunidad educativa.","La adopción masiva de Scratch valida el potencial de las herramientas de programación visual para la educación."
6,"Taipalus, T. (2020).","Taipalus, T. (2020). Database management system performance comparisons: A systematic literature review. Journal of Systems and Software, 170, 110818. https://doi.org/10.1016/j.jss.2020.110818","Comparación de sistemas gestores de bases de datos.","La selección del DBMS adecuado impacta directamente el rendimiento y la usabilidad de los sistemas de información.","Revisar comparaciones de rendimiento entre sistemas gestores de bases de datos.","Criterios de selección de DBMS. Rendimiento de sistemas. Usabilidad para usuarios novatos.","DBMS, rendimiento, sistemas de bases de datos.","La elección del sistema gestor influye significativamente en la experiencia del usuario y el rendimiento del sistema."
7,"Taipalus, T., & Siponen, M. (2018).","Taipalus, T., & Siponen, M. (2018). SQL and the barriers to entry for programming novices. Proceedings of the 18th Koli Calling International Conference on Computing Education Research, 1–9. https://doi.org/10.1145/3279720.3279736","Barreras de entrada al aprendizaje de SQL.","SQL presenta barreras específicas para estudiantes sin experiencia en programación que dificultan su aprendizaje inicial.","Identificar las principales dificultades que enfrentan los principiantes al aprender SQL.","Errores comunes en SQL. Barreras cognitivas. Dificultades sintácticas y semánticas.","SQL, barreras de aprendizaje, novatos en programación.","Las barreras de entrada al SQL requieren estrategias pedagógicas específicas para ser superadas efectivamente."
8,"Smelcer, J. B. (1995).","Smelcer, J. B. (1995). User errors in database query composition. International Journal of Human-Computer Studies, 42(4), 353–381. https://doi.org/10.1006/ijhc.1995.1017","Errores de usuarios en la construcción de consultas SQL.","Los usuarios no expertos cometen errores sistemáticos al construir consultas de bases de datos que están relacionados con la complejidad de la interfaz.","Analizar los tipos de errores cometidos por usuarios al formular consultas en bases de datos relacionales.","Errores de sintaxis. Errores semánticos. Dificultades de formulación de consultas.","errores SQL, usabilidad, consultas de bases de datos.","Las interfaces visuales pueden reducir significativamente los errores cometidos por usuarios novatos al construir consultas."
9,"Ahadi, A., Lister, R., & Teague, D. (2016).","Ahadi, A., Lister, R., & Teague, D. (2016). Falling behind early and staying behind when learning to program. ACM Transactions on Computing Education, 16(4), 1–23. https://doi.org/10.1145/2977241","Rezago temprano en el aprendizaje de programación.","Los estudiantes que se quedan atrás en las primeras semanas de un curso de programación tienden a mantener ese rezago durante todo el curso.","Analizar patrones de dificultad y rezago en estudiantes principiantes de programación.","Dificultades iniciales en programación. Rezago académico. Estrategias de intervención temprana.","aprendizaje de programación, rezago académico, intervención temprana.","Es fundamental intervenir tempranamente con herramientas accesibles para evitar el rezago en cursos de programación y bases de datos."
10,"Leutner, D. (2014).","Leutner, D. (2014). Motivation and emotion as mediators in multimedia learning. Learning and Instruction, 29, 174–175. https://doi.org/10.1016/j.learninstruc.2013.05.004","Motivación y emoción en el aprendizaje multimedia.","La motivación y las emociones juegan un papel mediador fundamental en la efectividad del aprendizaje con materiales multimedia.","Analizar el rol de la motivación y las emociones en el aprendizaje con tecnologías multimedia.","Motivación intrínseca. Emociones en el aprendizaje. Diseño de materiales digitales motivadores.","motivación, aprendizaje multimedia, emociones.","El diseño de herramientas educativas debe considerar factores motivacionales y emocionales para maximizar el aprendizaje."
11,"Wing, J. M. (2006).","Wing, J. M. (2006). Computational thinking. Communications of the ACM, 49(3), 33–35. https://doi.org/10.1145/1118178.1118215","Pensamiento computacional como habilidad fundamental.","El pensamiento computacional es una habilidad cognitiva esencial para todos los ciudadanos del siglo XXI no solo para los informáticos.","Definir y argumentar la importancia del pensamiento computacional en la educación general.","Abstracción. Descomposición de problemas. Pensamiento algorítmico. Generalización.","pensamiento computacional, abstracción, algoritmos.","Desarrollar el pensamiento computacional desde etapas tempranas mejora la capacidad de resolver problemas en cualquier disciplina."
12,"Brennan, K., & Resnick, M. (2012).","Brennan, K., & Resnick, M. (2012). New frameworks for studying and assessing the development of computational thinking. Proceedings of the Annual Meeting of the American Educational Research Association.","Evaluación del pensamiento computacional.","El pensamiento computacional puede evaluarse mediante marcos que consideren conceptos prácticas y perspectivas computacionales.","Proponer un marco para evaluar el desarrollo del pensamiento computacional en estudiantes.","Conceptos computacionales. Prácticas computacionales. Perspectivas computacionales. Evaluación del aprendizaje.","pensamiento computacional, evaluación, Scratch.","Las herramientas de programación visual como Scratch permiten desarrollar y evaluar el pensamiento computacional de forma efectiva."
13,"Grover, S., & Pea, R. (2013).","Grover, S., & Pea, R. (2013). Computational thinking in K–12: A review of the state of the field. Educational Researcher, 42(1), 38–43. https://doi.org/10.3102/0013189X12463051","Pensamiento computacional en educación básica y media.","El pensamiento computacional debe integrarse en los currículos educativos desde etapas tempranas para preparar a los estudiantes para el mundo digital.","Revisar el estado del arte sobre la enseñanza del pensamiento computacional en educación K-12.","Integración curricular del pensamiento computacional. Herramientas para su enseñanza. Evaluación del pensamiento computacional.","pensamiento computacional, currículo, educación K-12.","La integración del pensamiento computacional desde etapas tempranas mejora las habilidades digitales de los estudiantes."
14,"Ausubel, D. P. (2000).","Ausubel, D. P. (2000). The Acquisition and Retention of Knowledge: A Cognitive View. Springer.","Teoría del aprendizaje significativo.","El aprendizaje es significativo cuando el nuevo conocimiento se relaciona de manera no arbitraria con los conocimientos previos del estudiante.","Explicar los fundamentos de la teoría del aprendizaje significativo y su aplicación en contextos educativos.","Aprendizaje significativo. Conocimientos previos. Organizadores previos. Retención del conocimiento.","aprendizaje significativo, conocimiento previo, retención.","Las herramientas educativas deben conectar los nuevos contenidos con los conocimientos previos del estudiante para facilitar el aprendizaje significativo."
15,"Jonassen, D. H. (1999).","Jonassen, D. H. (1999). Designing constructivist learning environments. Instructional Design Theories and Models: A New Paradigm of Instructional Theory, 2, 215–239.","Diseño de entornos de aprendizaje constructivistas.","Los entornos de aprendizaje constructivistas permiten a los estudiantes construir conocimiento de manera activa mediante la resolución de problemas auténticos.","Analizar los principios del constructivismo aplicados al diseño de entornos de aprendizaje.","Constructivismo. Resolución de problemas. Aprendizaje activo. Diseño de entornos de aprendizaje.","constructivismo, aprendizaje activo, diseño instruccional.","Los entornos constructivistas apoyados por tecnología mejoran el aprendizaje al permitir la exploración activa del conocimiento."
16,"Sweller, J., van Merriënboer, J. J. G., & Paas, F. (1998).","Sweller, J., van Merriënboer, J. J. G., & Paas, F. (1998). Cognitive architecture and instructional design. Educational Psychology Review, 10(3), 251–296. https://doi.org/10.1023/A:1022193728205","Teoría de la carga cognitiva aplicada al diseño instruccional.","El diseño instruccional debe tener en cuenta la arquitectura cognitiva humana para minimizar la carga extraña y maximizar el aprendizaje.","Analizar cómo la carga cognitiva afecta el aprendizaje y cómo el diseño instruccional puede optimizarla.","Carga cognitiva intrínseca extraña y germane. Memoria de trabajo. Diseño de materiales instruccionales.","carga cognitiva, diseño instruccional, memoria de trabajo.","Reducir la carga cognitiva extraña mediante diseño instruccional adecuado mejora significativamente el aprendizaje."
17,"van Merriënboer, J. J. G., & Sweller, J. (2005).","van Merriënboer, J. J. G., & Sweller, J. (2005). Cognitive load theory and complex learning: Recent developments and future directions. Educational Psychology Review, 17(2), 147–177. https://doi.org/10.1007/s10648-005-3951-0","Carga cognitiva y aprendizaje complejo.","El aprendizaje de habilidades complejas como la programación y el manejo de bases de datos puede facilitarse mediante el diseño instruccional basado en la carga cognitiva.","Revisar los desarrollos recientes de la teoría de la carga cognitiva y su aplicación al aprendizaje complejo.","Aprendizaje complejo. Diseño de tareas. Gestión de la carga cognitiva.","carga cognitiva, aprendizaje complejo, diseño instruccional.","El diseño instruccional basado en la carga cognitiva es esencial para facilitar el aprendizaje de habilidades técnicas complejas como las bases de datos."
18,"Paas, F., Renkl, A., & Sweller, J. (2003).","Paas, F., Renkl, A., & Sweller, J. (2003). Cognitive load theory and instructional design: Recent developments. Educational Psychologist, 38(1), 1–4. https://doi.org/10.1207/S15326985EP3801_1","Desarrollos recientes en la teoría de la carga cognitiva.","Los avances en la teoría de la carga cognitiva ofrecen nuevas orientaciones para el diseño de materiales y entornos de aprendizaje más efectivos.","Presentar los avances más recientes de la teoría de la carga cognitiva y sus implicaciones para el diseño instruccional.","Nuevos desarrollos en carga cognitiva. Aplicaciones instruccionales. Diseño de materiales educativos.","carga cognitiva, instrucción, eficiencia del aprendizaje.","Los principios de la carga cognitiva deben guiar el diseño de herramientas educativas para maximizar la eficiencia del aprendizaje."
19,"Kirschner, P. A. (2002).","Kirschner, P. A. (2002). Cognitive load theory: Implications of cognitive load theory on the design of learning. Learning and Instruction, 12(1), 1–10. https://doi.org/10.1016/S0959-4752(01)00014-7","Implicaciones de la carga cognitiva en el diseño del aprendizaje.","La comprensión de la carga cognitiva es fundamental para diseñar entornos de aprendizaje que minimicen el esfuerzo innecesario y maximicen la comprensión.","Analizar las implicaciones prácticas de la teoría de la carga cognitiva en el diseño de entornos de aprendizaje.","Diseño del aprendizaje. Carga cognitiva y comprensión. Estrategias instruccionales.","carga cognitiva, diseño del aprendizaje, comprensión.","Diseñar entornos que reduzcan la carga cognitiva extraña permite que los estudiantes se concentren en la comprensión conceptual."
20,"Norman, D. A. (2013).","Norman, D. A. (2013). The Design of Everyday Things (revised ed.). Basic Books.","Principios de diseño centrado en el usuario.","El diseño de cualquier herramienta o sistema debe centrarse en las necesidades y capacidades del usuario para ser verdaderamente efectivo.","Explicar los principios de diseño que hacen que los objetos y sistemas sean intuitivos y fáciles de usar.","Affordances. Retroalimentación. Modelo conceptual del usuario. Diseño centrado en el usuario.","diseño centrado en el usuario, usabilidad, affordances.","Los sistemas bien diseñados se anticipan a las necesidades del usuario lo que es esencial para herramientas educativas accesibles."
21,"ISO 9241-11. (2018).","International Organization for Standardization. (2018). ISO 9241-11:2018 Ergonomics of human-system interaction — Part 11: Usability: Definitions and concepts. ISO.","Estándar internacional de usabilidad.","La usabilidad de un sistema se define por su efectividad eficiencia y satisfacción en el contexto de uso específico para el que fue diseñado.","Establecer definiciones y conceptos estándar para la evaluación de la usabilidad de sistemas interactivos.","Efectividad. Eficiencia. Satisfacción del usuario. Contexto de uso.","usabilidad, efectividad, eficiencia, satisfacción.","Evaluar la usabilidad de herramientas educativas bajo estándares ISO permite garantizar su calidad y efectividad."
22,"Brooke, J. (1996).","Brooke, J. (1996). SUS: A quick and dirty usability scale. In P. W. Jordan, B. Thomas, B. A. Weerdmeester, & A. L. McClelland (Eds.), Usability Evaluation in Industry (pp. 189–194). Taylor & Francis.","Escala de usabilidad del sistema (SUS).","La escala SUS es un instrumento confiable y económico para evaluar la usabilidad percibida de sistemas informáticos.","Presentar la escala SUS como herramienta de evaluación rápida de usabilidad.","Evaluación de usabilidad. Percepción del usuario. Instrumento SUS.","SUS, usabilidad, evaluación de sistemas.","El SUS es ampliamente utilizado para evaluar la usabilidad de herramientas educativas y sistemas interactivos."
23,"Dix, A., Finlay, J., Abowd, G., & Beale, R. (2004).","Dix, A., Finlay, J., Abowd, G., & Beale, R. (2004). Human-Computer Interaction (3rd ed.). Pearson.","Interacción humano-computador.","La interacción humano-computador estudia cómo las personas interactúan con los sistemas digitales con el objetivo de mejorar la experiencia del usuario.","Analizar los principios de la interacción humano-computador y su aplicación en el diseño de sistemas.","Modelos de interacción. Diseño de interfaces. Evaluación de usabilidad. Experiencia del usuario.","HCI, interfaz de usuario, experiencia de usuario.","El diseño centrado en el usuario mejora la experiencia con herramientas educativas y reduce las barreras de aprendizaje."
24,"Hernández-Sampieri, R., & Mendoza, C. P. (2018).","Hernández-Sampieri, R., & Mendoza, C. P. (2018). Metodología de la investigación: Las rutas cuantitativa cualitativa y mixta. McGraw-Hill.","Metodología de investigación mixta.","El enfoque mixto permite combinar métodos cuantitativos y cualitativos para obtener una comprensión más completa de los fenómenos educativos.","Presentar las rutas metodológicas cuantitativa cualitativa y mixta para la investigación científica.","Enfoque mixto. Diseño de investigación. Recolección de datos. Análisis de resultados.","metodología mixta, investigación cuantitativa, investigación cualitativa.","El enfoque mixto es el más adecuado para evaluar herramientas educativas pues permite medir tanto el rendimiento como la percepción de los estudiantes."
25,"Creswell, J. W., & Creswell, J. D. (2018).","Creswell, J. W., & Creswell, J. D. (2018). Research Design: Qualitative, Quantitative, and Mixed Methods Approaches (5th ed.). SAGE Publications.","Diseño de investigación en ciencias sociales y educación.","El diseño metodológico adecuado es fundamental para garantizar la validez y confiabilidad de los resultados de una investigación educativa.","Guiar a los investigadores en la selección y aplicación de diseños de investigación cualitativos cuantitativos y mixtos.","Diseño de investigación. Métodos mixtos. Validez y confiabilidad. Recolección y análisis de datos.","diseño de investigación, métodos mixtos, validez.","Los estudios sobre herramientas educativas se benefician de diseños mixtos que integren mediciones objetivas y percepciones subjetivas."
26,"Cohen, J. (1988).","Cohen, J. (1988). Statistical Power Analysis for the Behavioral Sciences (2nd ed.). Lawrence Erlbaum Associates.","Análisis estadístico en investigación educativa.","El tamaño del efecto es una medida fundamental para evaluar la magnitud y relevancia práctica de los resultados de una investigación.","Presentar métodos estadísticos para analizar el poder y el tamaño del efecto en investigaciones cuantitativas.","Tamaño del efecto. Potencia estadística. Significancia práctica. Análisis cuantitativo.","tamaño del efecto, potencia estadística, análisis cuantitativo.","Reportar el tamaño del efecto en estudios sobre herramientas educativas permite evaluar mejor la importancia práctica de los resultados."
27,"Campbell, D. T., & Stanley, J. C. (1963).","Campbell, D. T., & Stanley, J. C. (1963). Experimental and Quasi-Experimental Designs for Research. Rand McNally.","Diseños experimentales y cuasi-experimentales en investigación.","Los diseños cuasi-experimentales permiten evaluar el impacto de intervenciones educativas en contextos donde no es posible la asignación aleatoria.","Presentar los fundamentos de los diseños experimentales y cuasi-experimentales para la investigación educativa.","Validez interna y externa. Grupos de control. Diseño cuasi-experimental. Pre-test/post-test.","diseño cuasi-experimental, validez, grupo de control.","Los diseños cuasi-experimentales son apropiados para evaluar el impacto de herramientas educativas en entornos universitarios reales."
28,"UNESCO. (2015).","UNESCO. (2015). Rethinking Education: Towards a Global Common Good? UNESCO Publishing.","Educación como bien común global.","La educación debe ser repensada como un bien común que garantice acceso equitativo al conocimiento para todos los ciudadanos.","Analizar el rol de la educación en el desarrollo sostenible y la inclusión social.","Educación inclusiva. Acceso equitativo. Innovación pedagógica. Desarrollo sostenible.","educación inclusiva, acceso equitativo, ODS 4.","Las herramientas educativas accesibles son un mecanismo fundamental para garantizar la equidad en el acceso al conocimiento."
29,"Warschauer, M. (2003).","Warschauer, M. (2003). Technology and Social Inclusion: Rethinking the Digital Divide. MIT Press.","Brecha digital e inclusión tecnológica.","La brecha digital no es solo de acceso a dispositivos sino también de capacidades para usar la tecnología de manera efectiva.","Analizar las dimensiones de la brecha digital y sus implicaciones para la inclusión social y educativa.","Brecha digital. Inclusión tecnológica. Capacidades digitales. Acceso equitativo.","brecha digital, inclusión digital, competencias TIC.","Las herramientas educativas accesibles contribuyen a reducir la brecha digital al democratizar el acceso al conocimiento tecnológico."
30,"Ministerio de Educación Nacional de Colombia. (2013).","Ministerio de Educación Nacional. (2013). Competencias TIC para el desarrollo profesional docente. MEN.","Competencias TIC en educación en Colombia.","El desarrollo de competencias TIC en docentes y estudiantes es fundamental para mejorar la calidad educativa en Colombia.","Definir las competencias TIC necesarias para el desarrollo profesional docente en Colombia.","Competencias digitales. Formación docente. Innovación educativa. Contexto colombiano.","competencias TIC, educación colombiana, formación docente.","El desarrollo de competencias TIC es prioritario para mejorar la educación superior en Colombia contexto directo del proyecto."
31,"OCDE. (2019).","OCDE. (2019). OECD Skills Outlook 2019: Thriving in a Digital World. OECD Publishing. https://doi.org/10.1787/df80bc12-en","Habilidades digitales para el siglo XXI.","Las habilidades digitales son competencias esenciales para que los ciudadanos y trabajadores prosperen en la economía digital del siglo XXI.","Analizar las habilidades digitales necesarias para el desarrollo personal y profesional en el mundo actual.","Competencias digitales. Economía digital. Educación para el futuro. Inclusión digital.","habilidades digitales, competencias, economía digital.","La formación en herramientas digitales como gestores de bases de datos es esencial para preparar a los estudiantes para el mercado laboral actual."
32,"Alessi, S. M., & Trollip, S. R. (2001).","Alessi, S. M., & Trollip, S. R. (2001). Multimedia for Learning: Methods and Development (3rd ed.). Allyn & Bacon.","Desarrollo de software educativo multimedia.","El desarrollo de software educativo efectivo requiere integrar principios pedagógicos de usabilidad y de diseño multimedia.","Analizar métodos y principios para el desarrollo de software educativo de calidad.","Diseño de software educativo. Principios pedagógicos. Interactividad. Evaluación formativa.","software educativo, multimedia, diseño instruccional.","El software educativo bien diseñado integra principios pedagógicos y de usabilidad para maximizar el aprendizaje."
33,"Naps, T. L., et al. (2002).","Naps, T. L., Rößling, G., Almstrum, V., Dann, W., Fleischer, R., Hundhausen, C., Korhonen, A., Lauer, M., & Ross, B. (2002). Exploring the role of visualization and engagement in computer science education. ACM SIGCSE Bulletin, 34(4), 131–152. https://doi.org/10.1145/820127.820138","Visualización en educación en ciencias de la computación.","La visualización activa y el compromiso del estudiante son factores clave para mejorar el aprendizaje en cursos de computación.","Explorar el papel de las visualizaciones interactivas en la enseñanza de conceptos de computación.","Visualización de algoritmos. Compromiso estudiantil. Aprendizaje activo en computación.","visualización, educación en computación, aprendizaje activo.","Las visualizaciones interactivas mejoran significativamente la comprensión de conceptos abstractos en computación y bases de datos."
